{
  "status": "accepted",
  "analyzerModulePath": "java/reuse-analyzer",
  "analyzerVersion": "0.4",
  "schemaVersion": 1,
  "policySha256": "c573058a3bec7e26209654125a165e829649708a0d208ee72c1327d1faaa8e6e",
  "baselineSha256": "3b001f1221d4651bf0b354db5a607e0de170abf5484695558d8fdcabe18ddf3d",
  "bootstrapCommit": "bfa3f949d7544fa7de0707f359c1b0328d823d4e"
}
